{
  "$schema": "../schemas/conditor.schema.json",
  "schemaVersion": 1,
  "name": "conditor-clean-room",
  "components": [
    {
      "id": "praxis",
      "version": "3.6.0"
    },
    {
      "id": "ordo",
      "version": "1.4.0"
    },
    {
      "id": "visual-engineering",
      "version": "1.0.0"
    },
    {
      "id": "communication-engineering",
      "version": "1.0.0"
    },
    {
      "id": "limen",
      "version": "0.7.1"
    },
    {
      "id": "forma",
      "version": "0.4.1"
    },
    {
      "id": "folio",
      "version": "0.3.0"
    },
    {
      "id": "aegis",
      "version": "1.0.0"
    }
  ],
  "execution": {
    "enabled": true,
    "mission": "Build the clean-room governed application and prove completion through repository evidence.",
    "contractPath": "requirements/contract.md",
    "launcher": "codex"
  },
  "scaffold": {
    "kind": "fsharp-limen-web",
    "name": "conditor-clean-room"
  },
  "requirements": [
    {
      "id": "contract",
      "source": {
        "repository": "kemiller2002/communication-engineering",
        "commit": "4590d2fe6f7e80b339117d3fbee5803f2dd39122",
        "path": "README.md"
      },
      "targetPath": "requirements/contract.md"
    }
  ]
}
