{
  "$schema": "../schemas/conditor.schema.json",
  "schemaVersion": 1,
  "name": "evidence-triage-rehearsal",
  "components": [
    {
      "id": "praxis",
      "version": "3.1.4"
    },
    {
      "id": "ordo",
      "version": "1.3.0"
    },
    {
      "id": "visual-engineering",
      "version": "1.0.0"
    },
    {
      "id": "communication-engineering",
      "version": "1.0.0"
    },
    {
      "id": "limen",
      "version": "0.6.1"
    },
    {
      "id": "forma",
      "version": "0.2.0"
    },
    {
      "id": "folio",
      "version": "0.3.0"
    },
    {
      "id": "aegis",
      "version": "1.0.0"
    },
    {
      "id": "tutela",
      "version": "0.1.0"
    },
    {
      "id": "percepta",
      "version": "0.1.0"
    }
  ],
  "requirements": [
    {
      "id": "rehearsal-contract",
      "source": {
        "repository": "kemiller2002/conditor",
        "commit": "0295314f0e8a2ecd81bc58118ce4bc2a46579066",
        "path": "examples/rehearsal/evidence-triage.kickoff.json"
      },
      "targetPath": "kickoff/evidence-triage.kickoff.json"
    },
    {
      "id": "rehearsal-evidence-schema",
      "source": {
        "repository": "kemiller2002/conditor",
        "commit": "0295314f0e8a2ecd81bc58118ce4bc2a46579066",
        "path": "examples/rehearsal/completion-evidence.schema.json"
      },
      "targetPath": "kickoff/completion-evidence.schema.json"
    }
  ],
  "execution": {
    "enabled": true,
    "mission": "Build the Incident Evidence Triage Board from the canonical rehearsal contract without architecture coaching. Prove completion through tests and repository evidence.",
    "contractPath": "kickoff/evidence-triage.kickoff.json",
    "launcher": "codex"
  },
  "scaffold": {
    "kind": "fsharp-limen-web",
    "name": "evidence-triage-rehearsal"
  }
}
