{
  "$schema": "../schemas/conditor.schema.json",
  "schemaVersion": 1,
  "name": "conditor-current-native-lifecycle-rehearsal",
  "components": [
    {
      "id": "praxis",
      "version": "3.6.0"
    },
    {
      "id": "ordo",
      "version": "1.4.0"
    }
  ],
  "requirements": [],
  "execution": {
    "enabled": false
  }
}
