{
  "$schema": "./schemas/conditor.schema.json",
  "schemaVersion": 1,
  "name": "conditor",
  "components": [
    { "id": "praxis", "version": "3.1.4" },
    { "id": "ordo", "version": "1.5.0" },
    { "id": "visual-engineering", "version": "1.0.0" },
    { "id": "communication-engineering", "version": "1.0.0" }
  ],
  "execution": {
    "enabled": false
  }
}
